Date,Company,Category,Aircraft,Location,Description
3/12/2015,BNSF Railway Company,Utilities/Energy/Infrastructure,"AirRobot AR180, AirRobot AR200, 3DRobotics Spektre Industrial Multi-Rotor Aerial Vehicle",Texas,Evaluation and analysis of railroad infrastructure and operations.
2/18/2015,BOSH Precision Agriculture DBA Digital Harvest,Agriculture,BOSH Technologies Super Swiper,Virginia,Precision agricultural surveys.
4/17/2015,"Bowman Consulting Group, LTD","Utilities/Energy/Infrastructure, Construction",SenseFly eBee,Virginia,Topographic and feature mapping for the mining and construction industries.
6/8/2015,Brett Baker,"Education, Real Estate",DJI Phantom 2,Washington,Aerial videography and cinematography to enhance academic community awareness and augment real estate listing videos.
6/5/2015,Brian L. Short,Photo/Film,"DJI Phantom 2 Vision+, DJI Inspire 1",Kansas,"Aerial video and photography to be used in television commercials, weather, traffic and news reports, and sporting events."
4/17/2015,Bruce Pogosaew,"Education, Photo/Film",3DR Plane and Bumblebee–S,Arizona,"Aerial videography and cinematography to enhance academic community awareness for individuals and companies unfamiliar with the geographical layout of the metro Tucson and surrounding areas; augmentation of real estate listing videos; and the creation of visual and topography layout videos for Search and Rescue mission for state and local agencies, education, agricultural inspections and building and construction zone inspections."
4/22/2015,Bryan Cherry,"Photo/Film, Agriculture",DJI Phantom 2 Vision+,Kentucky,"Aerial photography, cinematography, videography, mapping, crop surveying, and inspections."
4/23/2015,Bryan W. Swann,"Photo/Film, Real Estate",DJI Inspire 1,Maryland,Enhancing academic community awareness and augment real estate listing videos and photographs.
3/11/2015,"Build Imagery, LLC","Photo/Film, Construction, Utilities/Energy/Infrastructure","3d Robotics Iris+, DJI Inspire 1",California,"Aerial photography of architectural, engineering, and construction industry sites; motion picture and television operations"
4/17/2015,"Building 10, LLC",Photo/Film,DJI S1000,--,"Aerial photography and filming, including closed-set."
1/23/2015,Burnz Eye View,Photo/Film,"DJI Phantom 2, DJI S100, DJI Inspire",California,"Aerial photography, inspection. (Amended 4/29/15)"
5/4/2015,"Butler, Fairman and Seufert, Inc","Construction, Utilities/Energy/Infrastructure",DJI Phantom 2,Indiana,"Aerial inspection, environmental monitoring, construction monitoring, and preliminary engineering report related imagery for civil engineering projects."
5/5/2015,C.E.T Aviation,Photo/Film,DJI Flame Wheel F550,Connecticut,Aerial filming and photography that will support the needs of the advertising and marketing in a variety of industries.
6/5/2015,"C.H. Fenstermaker & Associates, LLC",Utilities/Energy/Infrastructure,DJI S800,Louisiana,Sending a human observer or using helicopters to inspect such elevated structures carry certain risks. These risks can be avoided by using a small UAS under controlled conditions to photograph and document the state of the equipment.
4/16/2015,Cambervision Inc.,Education,DJI Phantom 2,Massachusetts,"Community training workshops, research and development, and aerial inspections of buildings and land within the United States."
4/24/2015,"Cape Productions, Inc.",Photo/Film,3DRobotics X8+,--,Video filming and observations.
2/13/2015,"Capital Aerial Video, LLC",Real Estate,DJI F550,Texas,Aerial photography of real property.
5/19/2015,Capstone Aviation Corporation,Conservation,DJI Phantom 2 Vision+,Illinois,"Aerial photography/ aerial inspection for business purposes over the following areas; over land, waterways, and oceans; operation over and/or in nonrestricted National Parks, National Forests, and non-navigable airspace using nonintrusive recording devices; and operation in otherwise unrestricted U.S. States and Territories."
6/8/2015,Cardno Limited,"Utilities/Energy/Infrastructure, Government Contracting",Altavian Nova R8400,--,"Aerial acquisitions and research in support of government entities, mining and natural resources, industrial and commercial entities, the petroleum industry, and the country‰Ûªs infrastructure."
6/12/2015,Caribbean Project Management,Construction,DJI Phantom 2,--,Aerial inspections of construction sites.
6/17/2015,"Cayalazac Enterprises, LLC","Photo/Film, Education, Real Estate",DJI Phantom 2 Vision+,Florida,Aerial videography and cinematography to enhance academic community awareness and augment real estate listing pictures and videos.
6/18/2015,CCLD Technologies,Utilities/Energy/Infrastructure,Aibotix X6,Georgia,Inspections for cell phone towers and other tall structures.
5/29/2015,CDG Engineers,Construction,DJI Phantom 2 Vision,Missouri,Aerial inspections or surveys that consist of still photographs or video.
5/13/2015,CDM Smith Inc,Utilities/Energy/Infrastructure,DJI Phantom 2 Vision,Massachusetts,"Aerial acquisitions in support of government entities, agriculture, scientific studies, railroad industry, and the oil and gas industries."
4/17/2015,"Celestial Imaging, LLC",Photo/Film,DJI Inspire 1,Idaho,Aerial photography and videography.
6/16/2015,CellAntenna Corporation,Utilities/Energy/Infrastructure,"DJI S1000 Spreading Wings, DJI Inspire, DJI 450 Flame Wheel Quadcopter, DJI 550 Flame Wheel Hexacopter",Florida,"Visual observation, inspection, and recording and RF signal extension and detection work."
5/1/2015,Chapman Aerospace LLC,"Real Estate, Photo/Film, Utilities/Energy/Infrastructure, Education"," DJI S1000+, DJI S900,",California,"Aerial photography and filming. Company services include: Real Estate Videography and Photography, TV Shows/ Films, Utility Inspections (Power Lines, Wind Turbines, Solar Farmes, Gas & Oil Pipelines), Construction Inspections, Visual Effects (VFX), Prop Drones for Movies, Agriculture Inspections and Data Collection, Sports Events. Company also runs a UAS flight school: Aero Academy."
5/8/2015,"Charles A. Brisbane, Inc.",Photo/Film,DJI Phantom 2 Vision+,New York,"Aerial photography, cinematography, and videography."
6/16/2015,"Charles Franklin, Inc.",Photo/Film,DJI Inspire 1,Texas,Closed-set filming for the motion picture and television industries.
4/8/2015,Charles J Lesowske,Real Estate,DJI Phantom FC40,Oregon,Aerial real estate photography.
4/8/2015,Cherokee UAS LLC,"Utilities/Energy/Infrastructure, Agriculture, Government Contracting, Conservation, Emergency Services",Altavian Nova F6500 Block III,New Mexico,"Aerial surveys and inspections for public agencies, such as Federal (BLM and USDA/UPHIS) and State agencies, requesting compliance inspection services, wildlife management support, wildfire fighting support, SAR and specific and occasional law enforcement support services. Private pipeline and power transmission companies and petroleum/gas producers are asking for data in order to improve their maintenance programs, environmental compliance, and installation security."
2/13/2015,"Chevron UAS, Inc.",Utilities/Energy/Infrastructure,Skycatch,California,Aerial imaging for safety and monitoring of controlled access oil and gas facilities.
5/5/2015,Christopher Gardner,Photo/Film,DJI Inspire 1,Florida,"Aerial photography, inspection, videography and cinematography."
5/14/2015,Christopher James Scherr,"Photo/Film, Real Estate",DJI Phantom 2,Missouri,Videography and photography for real estate and to enhance community academic awareness.
5/28/2015,Christopher Ryan Welsh,Photo/Film,Yuncee Q500 Typhoon and Blade 350 QX3.,New York,Aerial videography and photography
4/8/2015,"Chustz Surveying, Inc.","Utilities/Energy/Infrastructure, Agriculture",SenseFly eBee,Louisiana,Aerial mapping and surveying applications.
4/3/2015,"CineDrones, LLC",Photo/Film,"DJI S900, DJI S1000, DJI Inspire 1",Florida,Aerial photography.
6/9/2015,CinemaCapture Videography,"Photo/Film, Real Estate","DJI Phantom 2, DJI Inspire 1",Pennsylvania,"Aerial video and photography for wedding videography, real estate photography, special events, film sets, and landscape over certain areas of the United States."
4/21/2015,Cirrus Exploration Company,"Education, Utilities/Energy/Infrastructure","DJI Phantom 2 Vision+, DJI Inspire 1",Texas,"Flight instruction, commercial aerial work flight operations, student instruction, aerial photography and survey, and power line or pipeline patrol."
6/5/2015,City of McAllen,Photo/Film,DJI Phantom 2 Vision+,Texas,"Aerial inspections and surveys, photography, and videography operations."
12/10/2014,Clayco,Construction,Skycatch Unmanned Aircraft System,Illinois,"Aerial imaging, construction."
5/11/2015,"Clean Energy Renewables, LLC",Utilities/Energy/Infrastructure,Aibot X6 V2. ,Illinois,Aerial inspection of renewable wind power turbines.
4/9/2015,Climate Corp Precision Planting LLC,Agriculture,DJI Phantom 2,Illinois,"Research and development, agricultural modeling, simulations, and imaging."
6/8/2015,Cloud9Drones,"Utilities/Energy/Infrastructure, Photo/Film","C9D-BD (Butterfly Dragon), DJI‐S1000+, DJI Inspire 1, DJI Phantom 3, 3DR Solo, 3DR Iris+",Texas,"Aerial inspections of towers/tallstructures for multiple industries, and videography for film and marketing. (Amended 6/23/15)"
5/5/2015,Cobblestone Realty LLC,Real Estate, DJI Phantom 2,Indiana,Aerial videography and cinematography.
6/9/2015,"Coffee House Industries, LLC",Photo/Film,"DJI Phantom 2 Vision+, DJI Inspire 1",California,"Closed set filming of motion pictures, music videos, web videos, corporate videos, television programs and commercials and still photography."
6/16/2015,Coleman Engineering Company,Utilities/Energy/Infrastructure,DJI Phantom 2,Michigan,"Aerial photography, videography, and inspections."
4/9/2015,Colin Hinkle,Photo/Film," DJI Inspire 1, DJI Phantom 2 Vision, DJI Phantom 3",Illinois,Aerial photography. (Amended 6/3/15)
4/21/2015,"Colorado Cartographics, LLC",Utilities/Energy/Infrastructure,"DJI F550 Flamewheel, Tarot T810",Colorado,"Geospatial, surveying, and geosciences services for industries for regulatory compliance, public safety, and asset management."
5/5/2015,Come and Take it Photography,"Real Estate, Education",DJI Phantom 2 Vision,Texas,Academic community awareness and real estate operations.
2/24/2015,Commonwealth Edison Company,Utilities/Energy/Infrastructure,DJI S900,Illinois,"Electric transmission and distribution utility system monitoring, powerline inspections, and damage assessments."
6/18/2015,"Compass Light, Inc",Photo/Film,"Cinestar X-8 HL, DJI Inspire 1, DJI Phantom 2, DJI Phantom 3",Florida,Aerial photography for the motion picture and television industry for scripted closed set filming.
4/24/2015,"CompassData, Inc",Utilities/Energy/Infrastructure,Trimble UX5,Colorado,"Aerial photography for use in mapping and land surveying applications. Capturing still digital images that are used to produce precision digital map products including; point clouds, triangulated models, and contour maps of the surveyed area. Applications include agriculture, mining, professional surveying, environmental monitoring, oil & gas exploration and other similar activities."
4/21/2015,Consumers Energy Company,Utilities/Energy/Infrastructure,DJI S-1000,Michigan,"Research and development for public and worker safety; power restoration following storms; and new methods to effectively inspect power lines, electrical facilities, and vegetation, and rights of way."
4/21/2015,Contend Corporation,Photo/Film,DJI Spreading Wings S900,--,"Closed set motion picture filming, cinematography, and videography."
6/8/2015,Copper City Aviation Services LLC,Real Estate,"DJI Phantom Vision 2, DJI Inspire 1",Arizona,"Commercial aerial photography and videography of individual commercial, public, and residential properties and structures."
6/23/2015,Corvus Eye Productions LLC,"Photo/Film, Real Estate, Emergency Services","DJI Phantom Vision 2, Foxtech K130",Washington,"Aerial imaging cinematography for film commercial productions, real estate, monitoring of secured and controlled environments, and search and rescue."
5/21/2015,Cox Photography,"Utilities/Energy/Infrastructure, Real Estate",DJI Inspire 1,Illinois,Aerial photography and videography over coal mine stockpiles and residential property.
4/21/2015,Craig Byrom,"Photo/Film, Emergency Services",DJI S-1000,Texas,"Mapping of farm and ranch land for property owners to better understand their land and what areas need more attention. Services to law enforcement in small towns for search and rescue, given that typically they do not have the budget to own or have a UAS on hand to do search and rescue."
6/8/2015,Crosstimbers Video Partners LLC,Real Estate,DJI Phantom 2,Texas,"Real estate photography, videography, and aerial surveying for other commercial industries."
6/2/2015,"D&C Inspection Services, Inc.",Utilities/Energy/Infrastructure,"DJI Phantom 2 Vision, DJI Phantom 2 Vision +, Steadydrone QU4D, DJI S1000, DJI Inspire 1, DJI Flamewheel F550",Texas,"Inspections of industrial complexes, transportation facilities, and other structural entities."
4/27/2015,Daniel W. Achatz,Photo/Film,DJI Phantom 2,Washington,"Aerial photography using a light, unmanned aerial vehicle for homeowners and real estate brokers seeking to provide aerial images of homes being listed for sale in the Seattle metropolitan area."
4/3/2015,Danis Building Construction Company,Construction,DJI Phantom Vision 2+,Ohio,Aerial inspections on construction sites.
4/3/2015,Darling Geomatics,"Utilities/Energy/Infrastructure, Agriculture",SenseFly eBee,Arizona,Mapping and surveying for 3D modeling.
6/26/2015,Darryl W Lee Sr,"Construction, Real Estate, Photo/Video","DJI Phantom 2 Vision+, DJI Phantom 3, DJI Inspire 1, 3D Robotics Solo",Texas,"Aerial video and photography of construction sites, real estate and private property, events, and landscape over certain areas of the United States."
5/19/2015,"DARTdrones, LLC","Education, Emergency Services","DJI Phantom, DJI Phantom 2 Vision, DJI Phantom 2 Vision+",Pennsylvania,Training for recreational users and emergency services entities to use unmanned aerial vehicles.
4/22/2015,"Dave Marshall ‰ÛÒ Elk Ridge Ranch, LLC",Photo/Film,Phantom 2 Vision Plus,Indiana,Aerial videography and cinematography to enhance local tourism in the southern Indiana region
6/25/2015,Dave Woll,Real Estate,"DJI Phantom Vision+, DJI Phantom 3",Illinois,Aerial videography and photography of privately owned real estate.
5/29/2015,David Donald Halpin,"Construction, Real Estate","DJI Phantom 2 Vision+, DJI Inspire 1",Florida,"Aerial video and photography of construction sites, real estate, and landscape over certain areas of the United States."
5/28/2015,David Garith Grinnell,"Real Estate, Construction",DJI Phantom 2 Vision+ and DJI Inspire 1,Kentucky,"Aerial videography and photography of construction sites, real estate, and landscaping."
4/17/2015,David Ho,Real Estate,DJI Phantom 2 Vision+,Illinois,Aerial cinematography in video or still format to enhance real estate listings.
5/22/2015,David Smith,Photo/Film,"DJI Inspire 1, DJI Vision+",Pennsylvania,"Aerial photography, videography, and inspections."
4/9/2015,DeGrazia Music LLC,Photo/Film,"DJI Phantom 2 Vision+, DJI Inspire",Arizona,"Aerial cinematography and photography at controlled locations for use in motion picture, television, and music industries."
6/23/2015,Deland Drones,"Real Estate, Construction","Turnigy Talon 500, Tarot 680Pro",Florida,"Aerial video and photography of construction sites, real estate, events, and landscape."
5/21/2015,Dennis M Fisher,Real Estate,DJI Phantom 2 Vision+,Ohio,"Aerial photography, videography, and cinematography to enhance community awareness and to augment real estate videos"
6/23/2015,Desert West Land Surveys,"Utilities/Energy/Infrastructure, Construction",SenseFly eBee,Idaho,Precision land surveying applications.
6/23/2015,"DigiNovations, Inc","Photo/Film, Real Estate, Construction","DJI Phantom 2 Vision+, DJI Inspire 1",Massachusetts,"Aerial video and photography of construction sites, real estate, special events, film sets, and landscapes."
6/9/2015,Digitals By Ronnie,"Photo/Film, Real Estate, Education",Yuneec Q500 Typhoon,Colorado,"Aerial photography and/or video for real estate, architecture, land surveying, engineering and other related professional activities; aerial video and/or photography for television, public events, cinematography and newsgathering; aerial inspection/photography of residential/commercial structures; residential/commercial utility infrastructure; aerial video/photography to assist with search and rescue operations; and training for UAS operations."
6/25/2015,Discovery Management Group LLC,Photo/Film,DJI Phantom 2,Oregon,"Aerial mapping, photography, filmmaking, and photogrammetry"
6/26/2015,"Discovery Management Group, LLC","Education, Real Estate, Photo/Film, Agriculture",DJI Phantom 2,Oregon,"Aerial mapping to enhance academic community awareness, augment real estate listing videos, filmmaking, golf course mapping, agricultural mapping, and photogrammetry"
6/23/2015,"DividedSky Aerial Productions, LLC","Photo/Film, Agriculture","DJI Phantom Vision 2+, 3D Robotics Iris+, 3D Robotics X8+M, xCel Drones XD-1100 CF, xCel Drones XD–550 CDR",Virginia,Aerial imaging of secured and controlled sites.
5/28/2015,"Dock House Digital, LLC",Photo/Film,DJI T600,South Carolina,Aerial photography and videography
6/12/2015,Donan Solutions LLC,Insurance,"DJI Phantom 3, DJI Phantom 2 Vision+, DJI Phantom 2",Kentucky,Forensic engineering and fire investigation applications.
5/5/2015,"Donan Solutions, LLC","Agriculture, Utilities/Energy/Infrastructure", Sensefly eBee,Kentucky,Mapping and survey applications for mining surveys and agriculture inspections.
4/23/2015,Douglas R. Dorrer,"Education, Emergency Services",3DRobotics IRIS+,West Virginia,"Educational community outreach, aerial real property and pre/post environmental remediation surveys, and not-for-profit search and rescue operations supporting local law enforcement."
1/6/2015,"Douglas Trudeau, Tierra Antigua Realty",Real Estate,DJI Phantom 2 Vision+,Arizona,"Real estate photography, videography."
4/8/2015,Down East Emergency Medicine Institute,Emergency Services,VK–FF–X4 Multirotor and VK-Ranger EX–SAR Fixed Wing,Maine,Aerial search and rescue operations.
5/22/2015,DPR Construction,Construction,Skycatch,California,Aerial imaging for safety and monitoring of secured and controlled environment construction sites.
4/8/2015,"Draganfly Innovations, Inc.",Manufacturer,"Draganflyer X4P, Draganflyer X4ES, Draganflyer X6, Draganflyer Guardian",--,"Market research, aerial surveys, mapping and inspections."
6/29/2015,Drew's Aerial Photography,"Photo/Film, Construction, Real Estate","DJI Phantom 2 Vision+, DJI Inspire 1",Washington,"Aerial video and photography of construction sites, real estate, and landscape over certain areas of the United States."
4/3/2015,"Drone Fleet & Aerospace Management, Inc.","Utilities/Energy/Infrastructure, Photo/Film","DJI S1000, DJI Phantom 2, Drone‐Fleet Carbon Fiber V5, DJI S800, DJI S1000, Sensefly eBee RTK",California,"Evaluation and analysis of infrastructure inspections and operations, closed-set motion picture and television filming. (Amended 6/23/15)"
6/16/2015,"Drone for Hire, LLC","Agriculture, Emergency Services",Y6-Scout,California,"Precision agriculture, emergency services operations, aerial inspections."
6/12/2015,Drone Surveys and Reports,"Photo/Film, Real","DJI Phantom 2 Vision+, DJI Inspire 1",Texas,Aerial photography and survey for real estate and various industries
5/22/2015,Droneair Solutions,"Photo/Film, Construction, Utilities/Energy/Infrastructure","DJI S1000+, Aeryon SkyRanger",--,"Closed-set filming for the motion picture, television, and web industries and aerial inspection and environmental monitoring of industrial sites, transmission and storage facilities, construction facilities, and aerial surveys."
5/28/2015,"Dronenautix, LLC",Photo/Film,3D Robotics Iris+,California,Aerial photography.
4/23/2015,"DRONESTHATWORK, LLC",Utilities/Energy/Infrastructure,LB700,Ohio,Aerial inspection of elevated structures for the electric utility industry (or similar clients/uses).
4/21/2015,"Droneview, LLC","Photo/Film, Real Estate",DJI Phantom 2 Vision+,Texas,"Aerial cinematography and photography on rural ranch sites, rural RV resorts, enhancing real estate listings and other such tasks for business in the greater San Antonio Texas area."
5/13/2015,DroneWorks Inc,Photo/Film,DroneWorks i1,Florida,Precision aerial surveys and photography.
5/15/2015,"DroneWorks, Inc","Photo/Film, Real Estate",DJI Inspire 1,Florida,Aerial videography and cinematography to enhance academic community awareness and to augment real estate listing videos.
6/30/2015,"DronEye Imaging, LLC","Photo/Film, Agriculture","DJI Phantom 2 Vision Plus, DJI Inspire",Indiana,"Aerial photography, cinematography, videography, mapping, crop surveying, and inspections."
6/29/2015,DSJ LLC,Photo/Film,DJI Phantom 2 Vision+,Michigan,"Aerial photography and videography for community videos, photos and video of new and remodeled commercial buildings/projects, individual homeowner aerial photography/videography, photography and video of land developments for builders, and nature photos and videos in completely unpopulated areas and other community related events."
6/23/2015,"Duke Energy Business Services, LLC",Utilities/Energy/Infrastructure,AeroVironment Qube.,North Carolina,"Inspections of transmission and distribution lines, vegetation, coal ash ponds, boilers, stacks, absorbers, and solar arrays."
6/16/2015,DuPage County Stormwater Management,Government Contracting,DJI Phantom 2 Vision +,Illinois,Flood control facility inspections.
6/29/2015,Dyno Nobel Louisiana Ammonia LLC,Utilities/Energy/Infrastructure,DJI Phantom 2,Louisiana,"Aerial imaging for safety and monitoring of secured and controlled explosives manufacturing site,"
4/27/2015,"Eagle UAV Services, LLC",Agriculture,SenseFly eBee,Michigan,"Imaging flights for the purpose of precision agriculture and land survey. Images will be used to increase food production, identify environmental land issues and allow for land use planning."
6/9/2015,Eagle View Aerial Imaging LLC,"Real Estate, Construction, Conservation, Utilities/Energy/Infrastructure",DJI Inspire 1,California,"Aerial photography and videography services for real estate brokers, appraisers, property managers; builders of homes and buildings; solar panel installers; farmers; chambers of commerce and associated businesses for marketing campaigns; inspections of utilities; public agencies; and wildlife conservation organizations."
5/14/2015,Eagle-Eye Drone Service,Photo/Film,DJI Phantom 2 Vision+,Michigan,Aerial videography and cinematography.
4/23/2015,"Earth Forensics, Inc","Photo/Film, Utilities/Energy/Infrastructure",DJI Phantom 2 Vision+,California,Aerial photo services to quickly assess potentially hazardous conditions (landslide and flooding) that may pose as a detriment to the public safety.
5/20/2015,"Eastern Arizona Ag Center, Inc",Agriculture,Precision Drone Pacesetter,Arizona,Aerial photography for the agricultural industry for monitoring growing crops.
5/11/2015,"EDRM, Inc. DBA Midplains Ag.",Agriculture,SenseFly eBee,Nebraska,Mapping and survey applications.
5/1/2015,Edward Juden,"Agriculture, Photo/Film, Other-Security",DJI Phantom 2 Vision+,Texas,"Aerial photography, agriculture field inspection, and property monitoring."
6/5/2015,Edward Thomas Zakarian,Real Estate,Phantom 2 Vision+,Florida,Photography and videography of commercial and residential properties.
5/22/2015,EGM100x35 Aerial Solutions,Photo/Film,DJI Phantom 2,--,Aerial photography and videography.
6/5/2015,Electric Eye Aerial Scanning,Photo/Film,Skywalker X8 Flying Wing,Montana,"Aerial acquisition of video, 2D, 3D, and multi-spectral imagery."
6/5/2015,Elevated Cinematics LLC,Photo/Film,"DJI Phantom 2, Tarot 680",Georgia,Collection of aerial photo and video assets.
4/24/2015,Elevated Images,Photo/Film,DJI Phantom 2 Vision+,Pennsylvania,Aerial photography and videography in the South-East Pennsylvania and Central New Jersey area.
4/3/2015,Elevated Perspective Media,Photo/Film,"Aervonics Sky Jib frame, DJI A2 flight system",Rhode Island,Aerial cinematography and filming on closed sets.
5/21/2015,Elevated Vue,Photo/Film,DJI Inspire 1,Alabama,Aerial photography and videography.
6/5/2015,"EMC, Inc.","Utilities/Energy/Infrastructure, Construction, Government Contracting",SenseFly eBee,Mississippi,"Precision aerial mapping and survey for multiple industries, including transportation (highways, railroad, ports, harbors and waterways), construction, telecommunication, oil and gas, power suppliers, and the state and federal governments."
6/16/2015,Empire Unmanned LLC,Agriculture,3D Robotics AeroM,Idaho,Photogrammetry and crop scouting.
6/23/2015,"Empire Unmanned, LLC","Photo/Film, Real Estate, Agriculture, Emergency Services","DJI Phantom 2 Vision+, DJI Phantom 2, DJI Inspire 1, DJI S1000+, DJI S900",Idaho,"Aerial surveying, aerial photography, agriculture, wildlife and forestry monitoring, wild land firefighting support, patrolling, aerial inspection, real estate surveying, crew member training, and mapping operations."
4/16/2015,"Empire Unmanned, LLC",Agriculture,SenseFlyeBee Ag,Idaho,Precision photogrammetry and crop scouting for precision agriculture
5/20/2015,"Engineering Resources, LLC","Agriculture, Utilities/Energy/Infrastructure","SenseFly eBee, Sensefly eBee RTK",Texas,"Precision aerial surveys for agricultural applications, mining, construction and survey/GIS operations."
