Date,Company,Category,Aircraft,Location,Description
5/7/2015,"enrGies, Inc",Education,"Lockheed Martin Indago, Lockheed Martin Desert Hawk III, DJI Phantom Vision +, Precision Lancaster MK3, Aeromao Talon, Aeromao Aeromapper 300, Aeromao Aeromapper EV-2, DJI Inspire 1",Alabama,"Conduct aerial video and data gathering. The following were added in ammendment: Lockheed Martin Desert Hawk III, DJI Phantom Vision +, Precision Lancaster MK3, Aeromao Talon, Aeromao Aeromapper 300, Aeromao Aeromapper EV-2, DJI Inspire. ""Energies has a proven track record of providing quick-turn solutions, support, and training for manned and unmanned aviation; command, control, communication & intelligence, missile sensor programs, helicopter prototype integration; Air and Missile Defense systems; and tactical operation centers"""
4/29/2015,"enrGies, Inc.",Photo/Film,"Lockheed Martin Indago, Lockheed Martin Desert Hawk III, DJI Phantom Vision +, Precision Lancaster MK3, Aeromao Talon, Aeromao Aeromapper 300, Aeromao Aeromapper EV-2, DJI Inspire",Alabama,"Aerial video and data gathering in support of federal, state and local government agencies as well as the following private commercial ventures: basic photography, precision agriculture, pipeline/power line transmission/distribution towers, oil and gas facilities (on & off shore), manmade/natural disaster damage assessment, support to first responders, security, construction, research, wildlife and wildfire monitoring, real estate, local infrastructure, railroad infrastructure, surveying, scientific studies, insurance functions, training, mining and UAS research and development. (Amended 5/7/15)"
3/24/2015,"EnviroMINE, Inc.",Utilities/Energy/Infrastructure,SenseFly eBee,California,"Operations over areas of California and western Arizona suitable for, or in use by, surface mining."
6/16/2015,Enviroskycam,Conservation,DJI Phantom 2 Vision +,California,Environmental monitoring and wildlife conservation.
6/16/2015,Envision Security dba Envision Aerials,"Construction, Real Estate",DJI Inspire 1,Louisiana,"Aerial video and photography of client sites, construction sites, real estate, and landscape."
6/25/2015,"Envision Virtual Tours, Inc.",Real Estate,"DJI Phanton 2 Vision +, DJI Phantom 3 Professional, DJI Inspire 1",Georgia,Aerial Videography and Photography for real estate/
6/26/2015,Eric M Roberts,"Construction, Real Estate, Photo/Video","DJI Phantom 2, DJI Phantom 3",Nevada,"Aerial video and photography of construction sites, real estate, and landscape."
4/24/2015,Eric Silberg Photography,Photo/Film,DJI Inspire 1,Maryland,Photography and videography.
4/8/2015,Erie Insurance Group,Insurance,DJI Phantom 2,Pennsylvania,"Research and development; surveys and inspections; risk assessment, risk management, loss prevention and underwriting."
4/3/2015,"ETAK Systems, Inc.",Utilities/Energy/Infrastructure,"DJI Phantom 2, DJI Phantom 2 Vision +, DJI Phantom 3 ",North Carolina,Cellular tower and compound surveys for wireless providers. (Amended 6/3/15)
6/16/2015,Eugene Lew,Real Estate,"DJI Phantom 2 Vision+, DJI Inspire 1",Oregon,"Aerial photography and videography of real estate, vacant land, and subdivisions over certain areas of the United States."
6/30/2015,Evil Penguin Films,"Photo/Film, Agriculture",DJI Phantom 2,Louisiana,"Aerial photography, cinematography, videography, mapping, crop surveying, and inspections."
5/1/2015,Explosives Risk Managers LLC,Construction,"DJI Phantom II Vision+, Sensefly eBee, DJI Phantom 3 Professional, DJI Phantom 3 Advanced, DJI Inspire 1",Maryland,"Risk management services in blasting security, safety, and productivity. UAS to do photogrammetry, highwall inspections, shot filming, blast area security, post blast inspection and public relations media."
5/28/2015,"Extreme Aerial Works, LLC",Photo/Film,"DJI Phantom 2, Tarot 810, and DJI Inspire 1",North Carolina,"Aerial photography, videography"
4/8/2015,Extreme Media Productions,"Utilities/Energy/Infrastructure, Real Estate, Photo/Film",DJI Phantom 2 Vision+,South Carolina,"Real estate, marketing, surveying, industrial and special event operations."
3/6/2015,FalconSkyCam,"Photo/Film, Real Estate, Agriculture",DJI Phantom 2,California,"Aerial photography for real estate, surveying, marine photo and video, agriculture, and special events."
4/16/2015,Falkirk Mining Company,Utilities/Energy/Infrastructure,"SenseFly eBee, Trimble UX5",North Dakota,"Land surveying services. Applications may include agricultural applications, mining, construction and survey/GIS operations"
4/3/2015,"First Flight Photography, LLC",Photo/Film,"DJI Phantom 2 Vision Plus, DJI Spreading Wings S1000",New York,Aerial photography.
6/23/2015,FlightWink LLC,"Photo/Film, Utilities/Energy/Infrastructure, Conservation","Volantex Raptor, Tarot T−18",Kansas,"Operations for the agriculture, oil and gas, aerial photography and wildlife preservation industries."
5/14/2015,Flite Video LLC,Real Estate,"DJI Phantom 2 Vision+, DJI Phantom 3 Professional",California,"Operations for real estate inspections, sales and advertising."
5/11/2015,"Florida Aerial Services, Inc.",Photo/Film,"Steadidrone QU4D, DJI Inspire 1, DJI Phantom 3",Florida,"Aerial photography for the media and advertising industries for pre-planned, controlled area, photographic and surveying services. (Amended 6/23/15.)"
4/17/2015,"Florida Aerials, LLC",Real Estate,"DJI Phantom 2, DJI Phantom 2 Vision+",Florida,"Aaerial videography/cinematography to enhance academic community awareness for those unfamiliar with the geographical layout of the SE Florida area, and to augment real estate listing videos."
5/29/2015,"Fly Low Aero, LLC",Photo/Film,"DJI Phantom 2 Vision Plus, DJI Inspire 1, DJI S-900",Virginia,Aerial photography and survey for various industries.
10/10/2014,Flying Cam,"Manufacturer, Photo/Film",Flying-Cam 3.0 SARAH,California,Closed-set filming.
4/8/2015,Flying Cross Aerial Productions,Photo/Film,"DJI Phantom 2, DJI S1000",Texas,Aerial photography and filming.
6/30/2015,Flying Solutions,"Education, Real Estate, Photo/Film","DJI Phantom, DJI Inspire 1, 3DR Solo",Texas,"Flight training, education, real estate photography, videography, film and movie production, demonstration flights and inspections."
6/5/2015,Fovea Aero Systems LLC,Photo/Film,"DJI Phantom 2 Vision+, DJI Inspire 1, DJI S1000+",New Jersey,"Surveying, monitoring, inspections, videography, photography and filmmaking."
5/22/2015,Fovea Aero Systems LLC,"Utilities/Energy/Infrastructure, Photo/Film","DJI Phantom 2 Vision+, DJI Inspire 1, DJI S1000+",New Jersey,"Surveying, monitoring, inspections, videography, photography, closed-set motion picture and television filming. (Amended 6/5/15)"
5/19/2015,"Freeport-McMoRan, Inc.",Utilities/Energy/Infrastructure,Prioria Maveric,New Jersey,"Surveying, aerial photography, videography and data acquisition for mine-related services."
5/22/2015,"Fresh Cut Above, Inc.",Photo/Film,"DJI Phantom 2, DJI Inspire 1",California,Closed-set filming and aerial photography.
6/1/2015,Galaxy UAV Systems,Agriculture,"Universeye Penguin, DJI Inspire 1",Texas,Agriculture and aerial surveying missions utilizing geographic referenced mapping system
5/15/2015,Gary Huett,"Photo/Film, Real Estate",DJI Phantom 2 Vision+,Indiana,"Aerial videography/cinematography to enhance academic community awareness, augment real estate listing videos, document accident scene locations, mapping, crop surveying, inspections and other flight operations."
6/30/2015,"GDI Geospatial Data, Inc.","Education, Real Estate",Phantom 2 Vision+,Texas,"Enhance academic community awareness and augment real estate activities, right of way surveys, aerial videography for geographical awareness, and real estate marketing."
5/22/2015,"geoResource Technologies, Inc","Emergency Services, Real Estate, Agriculture, Construction",DJI S1000,Massachusetts,"Aerial mapping, survey, and inspection of buildings."
4/16/2015,"Geosky3, LLC","Real Estate, Photo/Film, Other-Security",DJI Inspire 1 Model T600,Florida,"Security services, real estate photography and Geographic Information Systems for business and personal use."
5/15/2015,"GeoWing Mapping, Inc.","Photo/Film, Utilities/Energy/Infrastructure",Altavian Nova F6500,California,"Aerial acquisitions and research within the NAS, commercially, in support of government entities, agriculture, scientific studies, wildlife monitoring, forestry, and the oil and gas industries."
5/28/2015,Gerald J. Cauchi,"Construction, Real Estate, Photo/Film",DJI Phantom 2 Vision+,California,"Aerial videograhpy and photography of construction/demolition sites, real estate, special events, and landscaping"
6/26/2015,Geum Services Inc,Photo/Film,"DJI Phantom 2, DJI Phantom 3",Michigan,Aerial photography and aerial video services.
4/24/2015,goFarm LLC,"Agriculture, Utilities/Energy/Infrastructure",GF–1,Maryland,"Precision aerial surveys that consist of still photographs taken by onboard cameras. Applications for these UAS devices and associated data processing functions include agriculture, mining, and professional surveying."
4/21/2015,"GPS Development, LLC dba SkyViewHD",Real Estate,DJI Phantom 2,Florida,Aerial videography and photography for real estate services.
6/26/2015,"GraVoc Associates, Inc","Photo/Film, Real Estate","DJI Phantom 2, DJI Inspire 1",Massachusetts,Aerial photography and videography.
6/23/2015,Green Bee Limited,"Photo/Film, Agriculture","DJI Phantom 2, Turbo Ace Matrix-E",Colorado,"Agricultural and golf course surveys. Digital surveys using an array of cameras to show crop thinning, or NDVI imagery. Allowing the property owner to see which crops or grass areas are improperly photosynthesizing. Aerial surveys of golf courses to show ball flight, and beauty of the course."
5/13/2015,Gregory Dirk Sichel,Real Estate,DJI Inspire 1,Florida,Aerial photography for the education of real estate professionals and real estate marketing purposes.
4/17/2015,Gregory Zonsius,Photo/Film,DJI Phantom 2 Vision +,Illinois,"Aerial photography, videography, and cinematography."
5/22/2015,"GridHawk Aviation, LLC",Utilities/Energy/Infrastructure,Aeryon SkyRanger,Illinois,"Aerial inspections of high-tension power distribution lines, systems, and structures."
5/13/2015,GSC Surveying Inc,"Utilities/Energy/Infrastructure, Construction",PrecisionHawk Hawkeye Mk-III,North Carolina,"Precision aerial surveys, including in the areas of construction, agriculture, mining, scientific studies, wildlife monitoring, forestry, and oil, power and gas industries."
4/8/2015,Gulf Coast Unmanned Aerial Services LLC,"Agriculture, Education","DJI Phantom, DJI Inspire",Louisiana,Aerial photography and videography for agricultural inspections and flight training.
6/5/2015,Guy Stacy Walker,"Photo/Film, Real Estate",DJI Inspire 1,Indiana,"Aerial photography and videography of real estate, landscapes, and commercial clients."
6/30/2015,"Haag 3D Solutions, LLC","Agriculture, Utilities/Energy/Infrastructure, Construction","DJI Phantom 3, DJI Phantom 2 Vision+, DJI Phantom 2",Texas,"Mapping, inspection and photography of landfills, mining facilities, utilities, oil and gas facilities, agriculture, construction sites, forensic engineering assessments, damage assessments and fire investigation applications."
4/8/2015,"Habana Avenue, LLC dba Fly Habana",Photo/Film,Cinestar 8 HL,Florida,"Aerial photography for motion picture, television, and the content creation industry for scripted closed set filming."
4/3/2015,"Hawaii AirVision, LLC",Photo/Film,DJI S1000,Hawaii,"Aerial videography and photography for the motion picture, television, and commercial industry for closed set filming."
6/23/2015,"Hawaii Commercial Drone Operations, LLP",Utilities/Energy/Infrastructure,Phantom 2 Vision,Hawaii,"Aerial photography, primarily for inspection of towers and structures."
4/8/2015,"Hawk Aerial, LLC","Utilities/Energy/Infrastructure, Agriculture","Multirotor G4 Eagle, DJI Phantom 2, Altavian Nova F6500, Altavian R8400, DJI Phantom 3",New Mexico,"Photogrammetry, inspections and analyses. (Amended 6/3/15)"
5/14/2015,"HAZON Solutions, LLC",Agriculture,"DJI Phantom 2, DJI S1000+, Draganflyer X4-ES, Universeye Penguin V2, Birdseyeview FireFly 6, Range Video RVJet, DJI Phantom 1, DJI Inspire 1",Virginia,Agriculture inspection and data collection.
5/14/2015,"HAZON Solutions, LLC",Photo/Film,"DJI Phantom 2, Draganflyer X4-ES sUAV, Universeye Penguin V2, Birdseyeview Aerobotics FireFly 6, Range Video RVJet, DJI S1000+",Virginia,Aerial imagery and videography.
5/11/2015,"HAZON Solutions, LLC","Agriculture, Utilities/Energy/Infrastructure","DJI Phantom 2, DJI S1000+, Draganflyer X4-ES, Penguin V2, Fire Fly 6, Range Video RV Jet",Virginia,Precision agriculture inspections/data collections and aerial mapping.
5/5/2015,"HAZON Solutions, LLC",Insurance,"DJI Phantom 2, DJI S1000+, Draganflyer X4-ES, Penguin V2,  Fire Fly 6",Virginia,"Crisis response support, including search and rescue, damage assessment, insurance claims assessment, and enhancing disaster site situational awareness for first responders."
4/27/2015,"HAZON Solutions, LLC",Utilities/Energy/Infrastructure,"DJI Phantom II, DJI S1000+, and DraganFlyer X4−ES",Virginia,Aerial infrastructure inspections will reduce risk to life and property by decreasing the requirement for personnel to climb structures and/or operate manned aircraft.
5/26/2015,Helicam Helicopters,Photo/Film,Draganfly Innovations X6,Washington,Aerial photography and videography for Washington state companies.
5/13/2015,Helicopters West LLC,Photo/Film,"DJI Inspire 1, SkyJib 8",Arizona,Aerial photography for the television and film industry.
2/3/2015,"Helinet Aviation Services, LLC",Photo/Film,"Gryphon Dynamics X8, DJI S1000",California,"Aerial filming, motion picture and television. (Amended 4/29/15)"
4/21/2015,HeliTek NW,"Photo/Film, Real Estate",DJI Inspire 1,Oregon,"Aerial videography and cinematography to enhance academic community awareness for those individuals and companies unfamiliar with the geographical layout of the metro Portland area. Augmented real estate listing videos, construction tracking photos and TV commercial videos."
9/25/2014,HeliVideo Productions,Photo/Film,"HVP- 14301 MultiRotor, Rotorcraft Model ERX12",Texas,Closed-set filming. (Amended 4/29/15)
6/30/2015,Hensrud Aerial,"Real Estate, Construction, Photo/Film, Emergency Services","DJI Inspire 1, DJI Phantom 3, DJI Spreading Wings, 3DRobotics Solo, 3DRobotics Aero, 3DRobotics IRIS+, 3DRobotics X8",North Dakota,"Aerial photography and/or video for real estate, architecture, land surveying, engineering, television, public events, cinematography, news gathering, inspections, live video feed for search and rescue operations, and UAS training."
5/5/2015,"High Adventure Air, Inc.","Agriculture, Construction, Emergency Services",DJI Inspire 1,Michigan,"Aerial acquisitions, research, and inspections, videography, gathering of agricultural data, natural resources, conservation, construction, infrastructure management and inspections, monitoring assessments, search and rescue operations, and reconnaissance in support of disaster or emergency situations."
5/5/2015,High Flight Photo,"Real Estate, Education","DJI Phantom 2 Vision+, DJI Inspire 1",Washington,Aerial videography and cinematography to enhance academic community awareness and to augment real estate listing videos.
6/17/2015,"Holder Construction Group, LLC",Construction,DJI Phantom 3,Georgia,Aerial imaging and monitoring of construction jobsites.
6/30/2015,HOVERCAMS LLC,Photo/Film,DJI Inspire 1,Michigan,Aerial video and photography of selected marketed real estate in order to safely provide interested parties additional information about a selected property here-to-for unattainable before purchase
4/16/2015,Hovershotsapv LLC,Photo/Film,Steadydrone QU4D,Florida,Aerial photography for the media and advertising industries.
4/3/2015,"HUVRData, LLC","Utilities/Energy/Infrastructure, Agriculture",AscTec (Ascending Technologies) Falcon 8,Texas,"Aerial imaging for wind farm survey, solar farm survey, inspection of industrial infrastructure including electrical towers, flare stacks and pipelines, and precision agriculture."
6/16/2015,HYSight Technologies,"Utilities/Energy/Infrastructure, Photo/Film, Agriculture","DJI Phantom 2 Vision+, DJI Phantom 3, DJI Inspire 1",Ohio,"Public safety support; inspection, monitoring, and patrolling; filmmaking, cinematography, and videography; precision agriculture; and surveying."
5/28/2015,I Drone Your Home,Real Estate,DJI Phantom 2,California,Aerial videography for realtors and private homeowners.
5/14/2015,"iBusiness Technologies, LLC","Real Estate, Construction",DJI Inspire 1,Pennsylvania,"Aerial acquisitions in support of the real estate industry, land survey industry, and construction industry."
4/8/2015,Idaho Forest Group,Other-Logging,Skycatch,Idaho,Aerial imaging in mill operations. Aerial imaging for safety and monitoring of secured and controlled environment mill sites.
6/23/2015,Idaho Power Company,"Scientific Studies, Conservation",MikroKopter sUAS,Idaho,"Low altitude environmental research and resource monitoring, including monitoring of salmon spawning activity in the Snake River."
5/22/2015,"iFly Media Productions, LLC",Photo/Film,DJI S900,Wisconsin,Aerial videography and photography.
5/14/2015,Ikust LLC,"Photo/Film, Real Estate",DJI Phantom 2 Vision+,Texas,Aerial videography and cinematography including real estate listing pictures and videos.
3/24/2015,"Industrial Aerobotics, LLC","Utilities/Energy/Infrastructure, Agriculture",Industrial Aerobotics SD02,Arizona,Precision aerial surveys.
6/23/2015,"InTEC of San Antonio, LP",Construction,"DJI Phantom Vision 2, DJI Phantom 3",Texas,Inspections and aerial surveys of construction sites.
5/11/2015,"Integrated Media Technologies, Inc",Photo/Film,"DJI S1000+, DJI Inspire 1, xFold Cinema.",California,Aerial photography and filming in motion picture and television operations.
6/16/2015,Internet Realty/Florida Keys Inc.,Real Estate,DJI Phantom 2 Vision Plus,Florida,Aerial videography and cinematography.
6/30/2015,J. Michael Tate dba AirVue,Real Estate,DJI Inspire 1,Georgia,Aerial video of selected marketed real estate in order to safely provide interested parties additional information about a selected property here-to-for unattainable before purchase
4/16/2015,Jackson Family Wines,Other-Security,AirCover QR−425,California,Surveillance over private property.
6/2/2015,Jaime Melgar,Photo/Film,DJI Phantom,Florida,Aerial videography and cinematography.
6/9/2015,"James Baldwin, Jr. dba SkyVideoCT","Photo/Film, Real Estate",DJI Inspire 1,Connecticut,"Aerial videography and or photography for real estate, marketing, surveying, industrial, and special events."
6/5/2015,James Hamlin,Photo/Film/Other,"DJI S1000, DJI Phantom 2",Georgia,"Search and rescue operations, aerial photography, videography, cinematography including motion picture and closed set television production."
6/29/2015,James Michael Hourihan,Emergency Services,"DJI Phantom 2 Vision, DJI Phantom 3, DJI S1000",Massachusetts,"EMS/fire emergency support, police operation support and missing persons support."
6/5/2015,Jason Sanko,Real Estate,DJI Phantom 2 Vision+,North Carolina,"Aerial photography, videography, and cinematography to enhance real estate listings."
5/4/2015,"Jason Youn Photography, LLC",Photo/Film,"DJI Phantom Vision 2 Plus+, DJI S900, DJI Inspire 1",Arizona,"Aerial videography and cinematography, mapping, and enhance academic community awareness."
4/21/2015,"JB Aerial, LLC",Utilities/Energy/Infrastructure,"DJI Phantom 2, DJI S-900",Florida,"Elevated photographic and remote sensing operations for businessed looking to improve reliability and power delivery with their awareness of structures on their respective properties through data collection by photographic, video graphic based inspections."
5/5/2015,Jeff Skelley Studio,Photo/Film,DJI Inspire 1,Arizona,"Aerial photography, videography and data collection."
5/14/2015,Jeffrey D. Greer,Photo/Film,"DJI Phantom 2 Vision+, DJI Inspire 1",Georgia,Aerial videography and cinematography.
4/17/2015,Jeffrey Galindo,"Education, Photo/Film",DJI PHANTOM 2 VISION +,Nevada,"Aerial videography/cinematography to enhance academic community awareness for those individuals/entities and companies unfamiliar with the geographical layout of the greater Las Vegas, NV, metropolitan area and to augment real estate research analysis and for-sale listing photographs and videos."
4/24/2015,Jeffrey Hug dba jeffhug360,Photo/Film,Phantom 2 Vision +,Nebraska,"Business photography, providing panoramic ‰ÛÏbusiness view‰Û services to businesses and panoramic or single photographs or videos."
3/24/2015,Jeffrey J. Walsh,"Utilities/Energy/Infrastructure, Agriculture, Government Contracting, Conservation","ALIGN TREX 500E, RITEWING Z3 Spade 47”, RITEWING Z4 Spade 52”, RITEWING Z3 Spade 70",Minnesota,"Aerial acquisition and research in support of Government entities, agriculture industry, utility companies, local infrastructure, scientific studies, wildlife monitoring, mining, surveying, and forestry."
6/30/2015,Jerry Brandau,"Photo/Film, Agriculture, Real Estate",DJI Phantom Vision+,Iowa,"Aerial photography, agriculture field inspection, and aerial property monitoring."
5/11/2015,"Jim Starwalt (Star Home Finders, Ltd)",Real Estate,DJI Phantom 2,Illinois,Aerial imaging and videography of communities and homes the petitioner list for sale.
6/16/2015,Jimmy W. Dean,"Construction, Real Estate",DJI Phantom 2 Vision+,Indiana,"Aerial video and photography of construction sites, real estate, and landscaping."
6/5/2015,John F. McCreary,"Photo/Film, Construction, Real Estate",DJI Phantom 2 Vision+,Illinois,"Aerial video and photography of construction sites, real estate, and landscape."
5/15/2015,John Keller,"Photo/Film, Utilities/Energy/Infrastructure, Real Estate",DJI Phantom 2 Vision+,North Carolina,"Aerial photography, structural inspections of bridges, pipelines, well and cell towers, real estate marketing, and surveys."
6/23/2015,"John R Jurgensen, Company",Utilities/Energy/Infrastructure,Event38 E384,Ohio,Aerial imagery operations to create 3D information and orthographic photos for quarry sites.
5/22/2015,John Sherman dba Mad Hornet Aerial Photography,Photo/Film,"Walkera Scout X4, DJI Inspire",Texas,Aerial photography and videography.
5/19/2015,Jonathan Harris,"Photo/Film, Real Estate",DJI Phantom,California,Aerial videography and cinematography to enhance real estate listings.
6/23/2015,Jonathan William Held,Photo/Film,P2 Multirotor,California,Aerial photography and videography.
6/16/2015,Joseph D. Renda,Real Estate,DJI Phantom 2 Vision+,Florida,Aerial photography and videography for real estate
5/11/2015,Joshua A. Strunk,"Real Estate, Research",DJI Phantom 2 Vision+,Connecticut,Aerial photography and cinematography to perform geographic studies and to augment real estate listings.
6/26/2015,JS Photography,"Photo/Film, Real Estate, Construction, Education",DJI Phantom 3 Professional,New Hampshire,"Aerial surveying of structures, event photography, real estate photography, aerial filmmaking and photography, construction site inspections and monitoring, and educational purposes."
4/22/2015,Just 1 UAV,Education,DJI Phantom 2 Vision+,Arizona,A UAS Flight Instruction Program to introduce students to the elements of UAS operation from a commercial and noncommercial perspective and how these operations must fit into the National Airspace System.
6/23/2015,KalScott Engineering,Government Contracting,"DJI Phantom, DJI S900, DJI S1000",Kansas,Test flights in support of current NASA contracts NNX14CA35P and NNX14CA07C.
5/28/2015,Keegan Kliman,Photo/Film,DJI Phantom 2,California,Aerial videography and cinematography.
6/16/2015,"KellAir Aerial Solutions, LLC","Real Estate, Agriculture, Construction","DJI Phantom 2, DJI Phantom 2 Vision+ v3, DJI Phantom 3",Florida,"Commercial and private real estate video and photography, mapping and land surveying, construction, forestry, and agriculture inspection."
5/22/2015,Kevin M. Kralicek,Photo/Film,Tarot 650,Texas,Aerial photography and videography.
5/1/2015,"Keystone Aerial Surveys, Inc.","Utilities/Energy/Infrastructure, Government Contracting, Emergency Services",Altavian Nova F6500,Pennsylvania,"Mapping ‰ÛÒ High resolution imagery will be used for small area mapping in situations where UAS acquisition is safer, more cost effective or faster than manned aircraft (as in disaster response/assessment, etc.); Government Agencies ‰ÛÒ Federal, State and Local; Engineering ‰ÛÒ Mining, waste disposal, pipelines, etc; Insurance ‰ÛÒ Claim assessment; Geographic Information Systems ‰ÛÒ Populating data for analysis, including precision agriculture; solar panel installation, maintenance and assessment; wireless installation and maintenance."
6/26/2015,Kovar & Associates LLC,"Agriculture, Government Contracting, Emergency Services, Education","DJI Phantom 2 Vision+, Event38 E384, PrecisionHawk Landcaster",--,"Precision farming and other agriculture applications; asset management for utilities, government agencies, and private firms; construction and land management; disaster response and search and rescue; and conducting research flights to collect data and establish and refine forensic processes, procedures, and tools for investigation of accidents and crimes."
6/12/2015,Kyle Norton,Real Estate,"DJI Phantom 2 Vision+, DJI Phantom 3",Connecticut,Aerial video and photography of real estate and landscape.
5/11/2015,"Lamac Engineering Company, Inc.",Construction,SenseFly eBee,Illinois,Mapping and survey applications.
5/22/2015,"LandBros Aerial Photography, LLC",Photo/Film,DJI Phantom 2,Louisiana,Aerial photography of industrial and commercial facilities.
